{
  "$schema": "https://json-schema.org/draft/2020-12/schema",
  "$id": "https://github.com/Metta-AI/coworld-tribal-quest/blob/main/quest_component.schema.json",
  "title": "Tribal Quest shared Coworld component descriptor",
  "type": "object",
  "additionalProperties": false,
  "required": [
    "$schema",
    "component_version",
    "component",
    "coworld",
    "mode",
    "entrypoint",
    "engine_module",
    "engine_runtime",
    "league",
    "config_contract",
    "results_contract",
    "replay_contract",
    "global_contract",
    "protocol",
    "player_route"
  ],
  "properties": {
    "$schema": { "const": "./quest_component.schema.json" },
    "component_version": { "const": 3 },
    "component": { "const": "tribal_quest" },
    "coworld": { "const": "tribal_fortress" },
    "mode": { "const": "quest" },
    "entrypoint": { "const": "src/tribal_quest.nim" },
    "engine_module": { "const": "tribal_fortress_engine" },
    "engine_runtime": { "const": "nimgrid" },
    "league": {
      "type": "object",
      "additionalProperties": false,
      "required": ["variant_ids", "player_count_min", "player_count_max", "tokens_field"],
      "properties": {
        "variant_ids": {
          "const": [
            "quest-2-adventurer",
            "quest-3-adventurer",
            "quest-4-adventurer",
            "quest-5-adventurer",
            "quest-6-adventurer",
            "quest-7-adventurer",
            "quest-8-adventurer"
          ]
        },
        "player_count_min": { "const": 2 },
        "player_count_max": { "const": 8 },
        "tokens_field": { "const": "tokens" }
      }
    },
    "config_contract": {
      "type": "object",
      "additionalProperties": false,
      "required": ["players_item", "required", "accepted_shared_fields"],
      "properties": {
        "players_item": {
          "type": "object",
          "additionalProperties": false,
          "required": ["required", "additional_properties"],
          "properties": {
            "required": { "const": ["name"] },
            "additional_properties": { "const": false }
          }
        },
        "required": {
          "type": "array",
          "const": [
            "mode",
            "tokens",
            "players",
            "max_steps",
            "seed",
            "steps_per_second",
            "player_connect_timeout_seconds",
            "num_agents",
            "team_count"
          ]
        },
        "accepted_shared_fields": {
          "type": "array",
          "const": ["victory_condition"]
        }
      }
    },
    "results_contract": {
      "type": "object",
      "additionalProperties": false,
      "required": ["required", "score_count_min", "score_count_max"],
      "properties": {
        "required": {
          "type": "array",
          "const": [
            "mode",
            "scores",
            "steps",
            "truncation_reason",
            "names",
            "survival_ticks",
            "explored_tiles"
          ]
        },
        "score_count_min": { "const": 2 },
        "score_count_max": { "const": 8 }
      }
    },
    "replay_contract": {
      "type": "object",
      "additionalProperties": false,
      "required": [
        "format",
        "load_env",
        "client_route",
        "stream_route",
        "message_type"
      ],
      "properties": {
        "format": { "const": "tribal-quest-replay-v1" },
        "load_env": { "const": "COGAME_LOAD_REPLAY_URI" },
        "client_route": { "const": "/client/replay" },
        "stream_route": { "const": "/replay" },
        "message_type": { "const": "text/json" }
      }
    },
    "global_contract": {
      "type": "object",
      "additionalProperties": false,
      "required": [
        "client_route",
        "stream_route",
        "protocol",
        "init_type",
        "update_type",
        "message_type"
      ],
      "properties": {
        "client_route": { "const": "/client/global" },
        "stream_route": { "const": "/global" },
        "protocol": { "const": "tribal-quest-global-v1" },
        "init_type": { "const": "view.init" },
        "update_type": { "const": "view.update" },
        "message_type": { "const": "text/json" }
      }
    },
    "protocol": { "const": "sprite_v1" },
    "player_route": { "const": "/player" }
  }
}
