{
  "$schema": "./quest_component.schema.json",
  "component_version": 3,
  "component": "tribal_quest",
  "coworld": "tribal_fortress",
  "mode": "quest",
  "entrypoint": "src/tribal_quest.nim",
  "engine_module": "tribal_fortress_engine",
  "engine_runtime": "nimgrid",
  "league": {
    "variant_ids": [
      "quest-2-adventurer",
      "quest-3-adventurer",
      "quest-4-adventurer",
      "quest-5-adventurer",
      "quest-6-adventurer",
      "quest-7-adventurer",
      "quest-8-adventurer"
    ],
    "player_count_min": 2,
    "player_count_max": 8,
    "tokens_field": "tokens"
  },
  "config_contract": {
    "players_item": {
      "required": ["name"],
      "additional_properties": false
    },
    "required": [
      "mode",
      "tokens",
      "players",
      "max_steps",
      "seed",
      "steps_per_second",
      "player_connect_timeout_seconds",
      "num_agents",
      "team_count"
    ],
    "accepted_shared_fields": [
      "victory_condition"
    ]
  },
  "results_contract": {
    "required": [
      "mode",
      "scores",
      "steps",
      "truncation_reason",
      "names",
      "survival_ticks",
      "explored_tiles"
    ],
    "score_count_min": 2,
    "score_count_max": 8
  },
  "replay_contract": {
    "format": "tribal-quest-replay-v1",
    "load_env": "COGAME_LOAD_REPLAY_URI",
    "client_route": "/client/replay",
    "stream_route": "/replay",
    "message_type": "text/json"
  },
  "global_contract": {
    "client_route": "/client/global",
    "stream_route": "/global",
    "protocol": "tribal-quest-global-v1",
    "init_type": "view.init",
    "update_type": "view.update",
    "message_type": "text/json"
  },
  "protocol": "sprite_v1",
  "player_route": "/player"
}
